[
  {
    "caseId": "mw-pwg-pwk:ac",
    "target": "tei",
    "status": "partial",
    "phenomenon": "generic-lexicographer-hedge",
    "sourceDictionary": "mw",
    "sourcePointer": {
      "L": "1767",
      "line": 6421
    },
    "claim": "MW L. evidence preservation",
    "loss": "TEI can preserve string/type but not shared evidential semantics",
    "extensionNeeded": true,
    "reviewStatus": "machine"
  },
  {
    "caseId": "mw-pwg-pwk:ac",
    "target": "ontolex",
    "status": "partial",
    "phenomenon": "generic-lexicographer-hedge",
    "sourceDictionary": "mw",
    "sourcePointer": {
      "L": "1767",
      "line": 6421
    },
    "claim": "MW L. evidence preservation",
    "loss": "Needs explicit evidence/provenance node",
    "extensionNeeded": true,
    "reviewStatus": "machine"
  },
  {
    "caseId": "mw-pwg-pwk:ac",
    "target": "tei",
    "status": "partial",
    "phenomenon": "root-as-entry",
    "sourceDictionary": "mw",
    "sourcePointer": {
      "L": "1767",
      "line": 6421
    },
    "claim": "Root modeling",
    "loss": "Root as entry is preservable; derivational role is not fully explicit",
    "extensionNeeded": false,
    "reviewStatus": "machine"
  },
  {
    "caseId": "mw-pwg-pwk:ac",
    "target": "ontolex",
    "status": "lossy",
    "phenomenon": "root-as-derivational-base",
    "sourceDictionary": "mw",
    "sourcePointer": {
      "L": "1767",
      "line": 6421
    },
    "claim": "Root modeling",
    "loss": "Root needs lexical plus derivational relation",
    "extensionNeeded": true,
    "reviewStatus": "machine"
  },
  {
    "caseId": "mw-pwg-pwk:ah",
    "target": "tei",
    "status": "partial",
    "phenomenon": "generic-lexicographer-hedge",
    "sourceDictionary": "mw",
    "sourcePointer": {
      "L": "21630",
      "line": 77189
    },
    "claim": "MW L. evidence preservation",
    "loss": "TEI can preserve string/type but not shared evidential semantics",
    "extensionNeeded": true,
    "reviewStatus": "machine"
  },
  {
    "caseId": "mw-pwg-pwk:ah",
    "target": "ontolex",
    "status": "partial",
    "phenomenon": "generic-lexicographer-hedge",
    "sourceDictionary": "mw",
    "sourcePointer": {
      "L": "21630",
      "line": 77189
    },
    "claim": "MW L. evidence preservation",
    "loss": "Needs explicit evidence/provenance node",
    "extensionNeeded": true,
    "reviewStatus": "machine"
  },
  {
    "caseId": "mw-pwg-pwk:ah",
    "target": "tei",
    "status": "partial",
    "phenomenon": "root-as-entry",
    "sourceDictionary": "mw",
    "sourcePointer": {
      "L": "21630",
      "line": 77189
    },
    "claim": "Root modeling",
    "loss": "Root as entry is preservable; derivational role is not fully explicit",
    "extensionNeeded": false,
    "reviewStatus": "machine"
  },
  {
    "caseId": "mw-pwg-pwk:ah",
    "target": "ontolex",
    "status": "lossy",
    "phenomenon": "root-as-derivational-base",
    "sourceDictionary": "mw",
    "sourcePointer": {
      "L": "21630",
      "line": 77189
    },
    "claim": "Root modeling",
    "loss": "Root needs lexical plus derivational relation",
    "extensionNeeded": true,
    "reviewStatus": "machine"
  },
  {
    "caseId": "mw-pwg-pwk:akz",
    "target": "tei",
    "status": "partial",
    "phenomenon": "generic-lexicographer-hedge",
    "sourceDictionary": "mw",
    "sourcePointer": {
      "L": "423",
      "line": 1539
    },
    "claim": "MW L. evidence preservation",
    "loss": "TEI can preserve string/type but not shared evidential semantics",
    "extensionNeeded": true,
    "reviewStatus": "machine"
  },
  {
    "caseId": "mw-pwg-pwk:akz",
    "target": "ontolex",
    "status": "partial",
    "phenomenon": "generic-lexicographer-hedge",
    "sourceDictionary": "mw",
    "sourcePointer": {
      "L": "423",
      "line": 1539
    },
    "claim": "MW L. evidence preservation",
    "loss": "Needs explicit evidence/provenance node",
    "extensionNeeded": true,
    "reviewStatus": "machine"
  },
  {
    "caseId": "mw-pwg-pwk:akz",
    "target": "tei",
    "status": "partial",
    "phenomenon": "root-as-entry",
    "sourceDictionary": "mw",
    "sourcePointer": {
      "L": "423",
      "line": 1539
    },
    "claim": "Root modeling",
    "loss": "Root as entry is preservable; derivational role is not fully explicit",
    "extensionNeeded": false,
    "reviewStatus": "machine"
  },
  {
    "caseId": "mw-pwg-pwk:akz",
    "target": "ontolex",
    "status": "lossy",
    "phenomenon": "root-as-derivational-base",
    "sourceDictionary": "mw",
    "sourcePointer": {
      "L": "423",
      "line": 1539
    },
    "claim": "Root modeling",
    "loss": "Root needs lexical plus derivational relation",
    "extensionNeeded": true,
    "reviewStatus": "machine"
  },
  {
    "caseId": "mw-pwg-pwk:am",
    "target": "tei",
    "status": "partial",
    "phenomenon": "generic-lexicographer-hedge",
    "sourceDictionary": "mw",
    "sourcePointer": {
      "L": "13748",
      "line": 49569
    },
    "claim": "MW L. evidence preservation",
    "loss": "TEI can preserve string/type but not shared evidential semantics",
    "extensionNeeded": true,
    "reviewStatus": "machine"
  },
  {
    "caseId": "mw-pwg-pwk:am",
    "target": "ontolex",
    "status": "partial",
    "phenomenon": "generic-lexicographer-hedge",
    "sourceDictionary": "mw",
    "sourcePointer": {
      "L": "13748",
      "line": 49569
    },
    "claim": "MW L. evidence preservation",
    "loss": "Needs explicit evidence/provenance node",
    "extensionNeeded": true,
    "reviewStatus": "machine"
  },
  {
    "caseId": "mw-pwg-pwk:am",
    "target": "tei",
    "status": "partial",
    "phenomenon": "root-as-entry",
    "sourceDictionary": "mw",
    "sourcePointer": {
      "L": "13748",
      "line": 49569
    },
    "claim": "Root modeling",
    "loss": "Root as entry is preservable; derivational role is not fully explicit",
    "extensionNeeded": false,
    "reviewStatus": "machine"
  },
  {
    "caseId": "mw-pwg-pwk:am",
    "target": "ontolex",
    "status": "lossy",
    "phenomenon": "root-as-derivational-base",
    "sourceDictionary": "mw",
    "sourcePointer": {
      "L": "13748",
      "line": 49569
    },
    "claim": "Root modeling",
    "loss": "Root needs lexical plus derivational relation",
    "extensionNeeded": true,
    "reviewStatus": "machine"
  },
  {
    "caseId": "mw-pwg-pwk:aMh-mw107",
    "target": "tei",
    "status": "partial",
    "phenomenon": "generic-lexicographer-hedge",
    "sourceDictionary": "mw",
    "sourcePointer": {
      "L": "107",
      "line": 364
    },
    "claim": "MW L. evidence preservation",
    "loss": "TEI can preserve string/type but not shared evidential semantics",
    "extensionNeeded": true,
    "reviewStatus": "machine"
  },
  {
    "caseId": "mw-pwg-pwk:aMh-mw107",
    "target": "ontolex",
    "status": "partial",
    "phenomenon": "generic-lexicographer-hedge",
    "sourceDictionary": "mw",
    "sourcePointer": {
      "L": "107",
      "line": 364
    },
    "claim": "MW L. evidence preservation",
    "loss": "Needs explicit evidence/provenance node",
    "extensionNeeded": true,
    "reviewStatus": "machine"
  },
  {
    "caseId": "mw-pwg-pwk:aMh-mw107",
    "target": "tei",
    "status": "partial",
    "phenomenon": "root-as-entry",
    "sourceDictionary": "mw",
    "sourcePointer": {
      "L": "107",
      "line": 364
    },
    "claim": "Root modeling",
    "loss": "Root as entry is preservable; derivational role is not fully explicit",
    "extensionNeeded": false,
    "reviewStatus": "machine"
  },
  {
    "caseId": "mw-pwg-pwk:aMh-mw107",
    "target": "ontolex",
    "status": "lossy",
    "phenomenon": "root-as-derivational-base",
    "sourceDictionary": "mw",
    "sourcePointer": {
      "L": "107",
      "line": 364
    },
    "claim": "Root modeling",
    "loss": "Root needs lexical plus derivational relation",
    "extensionNeeded": true,
    "reviewStatus": "machine"
  },
  {
    "caseId": "mw-pwg-pwk:aMh-mw114",
    "target": "tei",
    "status": "partial",
    "phenomenon": "generic-lexicographer-hedge",
    "sourceDictionary": "mw",
    "sourcePointer": {
      "L": "114",
      "line": 392
    },
    "claim": "MW L. evidence preservation",
    "loss": "TEI can preserve string/type but not shared evidential semantics",
    "extensionNeeded": true,
    "reviewStatus": "machine"
  },
  {
    "caseId": "mw-pwg-pwk:aMh-mw114",
    "target": "ontolex",
    "status": "partial",
    "phenomenon": "generic-lexicographer-hedge",
    "sourceDictionary": "mw",
    "sourcePointer": {
      "L": "114",
      "line": 392
    },
    "claim": "MW L. evidence preservation",
    "loss": "Needs explicit evidence/provenance node",
    "extensionNeeded": true,
    "reviewStatus": "machine"
  },
  {
    "caseId": "mw-pwg-pwk:aMh-mw114",
    "target": "tei",
    "status": "partial",
    "phenomenon": "root-as-entry",
    "sourceDictionary": "mw",
    "sourcePointer": {
      "L": "114",
      "line": 392
    },
    "claim": "Root modeling",
    "loss": "Root as entry is preservable; derivational role is not fully explicit",
    "extensionNeeded": false,
    "reviewStatus": "machine"
  },
  {
    "caseId": "mw-pwg-pwk:aMh-mw114",
    "target": "ontolex",
    "status": "lossy",
    "phenomenon": "root-as-derivational-base",
    "sourceDictionary": "mw",
    "sourcePointer": {
      "L": "114",
      "line": 392
    },
    "claim": "Root modeling",
    "loss": "Root needs lexical plus derivational relation",
    "extensionNeeded": true,
    "reviewStatus": "machine"
  },
  {
    "caseId": "mw-pwg-pwk:an",
    "target": "tei",
    "status": "partial",
    "phenomenon": "generic-lexicographer-hedge",
    "sourceDictionary": "mw",
    "sourcePointer": {
      "L": "4782",
      "line": 17305
    },
    "claim": "MW L. evidence preservation",
    "loss": "TEI can preserve string/type but not shared evidential semantics",
    "extensionNeeded": true,
    "reviewStatus": "machine"